{
  "name": "DShareFactory",
  "version": "0.3.2",
  "deployments": {
    "production": {
      "1": "0x60B5E7eEcb2AEE0382db86491b8cFfA39347c747",
      "11155111": "0x92289a641517BA65438605eF0EeCF5fFB08B597c",
      "42161": "0xB4Ca72eA4d072C779254269FD56093D3ADf603b8",
      "81457": "0x6Aa1BDa7e764BC62589E64F371A4022B80B3c72a"
    },
    "staging": {
      "11155111": "0x9C0d82875c7C8482F9B9f15dd26303D746F47B89",
      "421614": "0x8A9b764204098AfF161A34353dC835bf5BB49Ce4",
      "168587773": "0xfd7681D09067451a34991A1c84ec98d57262cf5e"
    }
  },
  "abi": [
    {
      "type": "constructor",
      "inputs": [],
      "stateMutability": "nonpayable"
    },
    {
      "type": "function",
      "name": "UPGRADE_INTERFACE_VERSION",
      "inputs": [],
      "outputs": [
        {
          "name": "",
          "type": "string",
          "internalType": "string"
        }
      ],
      "stateMutability": "view"
    },
    {
      "type": "function",
      "name": "announceExistingDShare",
      "inputs": [
        {
          "name": "dShare",
          "type": "address",
          "internalType": "address"
        },
        {
          "name": "wrappedDShare",
          "type": "address",
          "internalType": "address"
        }
      ],
      "outputs": [],
      "stateMutability": "nonpayable"
    },
    {
      "type": "function",
      "name": "createDShare",
      "inputs": [
        {
          "name": "owner",
          "type": "address",
          "internalType": "address"
        },
        {
          "name": "name",
          "type": "string",
          "internalType": "string"
        },
        {
          "name": "symbol",
          "type": "string",
          "internalType": "string"
        },
        {
          "name": "wrappedName",
          "type": "string",
          "internalType": "string"
        },
        {
          "name": "wrappedSymbol",
          "type": "string",
          "internalType": "string"
        }
      ],
      "outputs": [
        {
          "name": "dShare",
          "type": "address",
          "internalType": "address"
        },
        {
          "name": "wrappedDShare",
          "type": "address",
          "internalType": "address"
        }
      ],
      "stateMutability": "nonpayable"
    },
    {
      "type": "function",
      "name": "getDShareBeacon",
      "inputs": [],
      "outputs": [
        {
          "name": "",
          "type": "address",
          "internalType": "address"
        }
      ],
      "stateMutability": "view"
    },
    {
      "type": "function",
      "name": "getDShares",
      "inputs": [],
      "outputs": [
        {
          "name": "",
          "type": "address[]",
          "internalType": "address[]"
        },
        {
          "name": "",
          "type": "address[]",
          "internalType": "address[]"
        }
      ],
      "stateMutability": "view"
    },
    {
      "type": "function",
      "name": "getTransferRestrictor",
      "inputs": [],
      "outputs": [
        {
          "name": "",
          "type": "address",
          "internalType": "address"
        }
      ],
      "stateMutability": "view"
    },
    {
      "type": "function",
      "name": "getWrappedDShareBeacon",
      "inputs": [],
      "outputs": [
        {
          "name": "",
          "type": "address",
          "internalType": "address"
        }
      ],
      "stateMutability": "view"
    },
    {
      "type": "function",
      "name": "initialize",
      "inputs": [
        {
          "name": "_owner",
          "type": "address",
          "internalType": "address"
        },
        {
          "name": "_dShareBeacon",
          "type": "address",
          "internalType": "address"
        },
        {
          "name": "_wrappedDShareBeacon",
          "type": "address",
          "internalType": "address"
        },
        {
          "name": "_transferRestrictor",
          "type": "address",
          "internalType": "address"
        }
      ],
      "outputs": [],
      "stateMutability": "nonpayable"
    },
    {
      "type": "function",
      "name": "owner",
      "inputs": [],
      "outputs": [
        {
          "name": "",
          "type": "address",
          "internalType": "address"
        }
      ],
      "stateMutability": "view"
    },
    {
      "type": "function",
      "name": "proxiableUUID",
      "inputs": [],
      "outputs": [
        {
          "name": "",
          "type": "bytes32",
          "internalType": "bytes32"
        }
      ],
      "stateMutability": "view"
    },
    {
      "type": "function",
      "name": "renounceOwnership",
      "inputs": [],
      "outputs": [],
      "stateMutability": "nonpayable"
    },
    {
      "type": "function",
      "name": "setNewTransferRestrictor",
      "inputs": [
        {
          "name": "_transferRestrictor",
          "type": "address",
          "internalType": "address"
        }
      ],
      "outputs": [],
      "stateMutability": "nonpayable"
    },
    {
      "type": "function",
      "name": "transferOwnership",
      "inputs": [
        {
          "name": "newOwner",
          "type": "address",
          "internalType": "address"
        }
      ],
      "outputs": [],
      "stateMutability": "nonpayable"
    },
    {
      "type": "function",
      "name": "upgradeToAndCall",
      "inputs": [
        {
          "name": "newImplementation",
          "type": "address",
          "internalType": "address"
        },
        {
          "name": "data",
          "type": "bytes",
          "internalType": "bytes"
        }
      ],
      "outputs": [],
      "stateMutability": "payable"
    },
    {
      "type": "event",
      "name": "DShareAdded",
      "inputs": [
        {
          "name": "dShare",
          "type": "address",
          "indexed": true,
          "internalType": "address"
        },
        {
          "name": "wrappedDShare",
          "type": "address",
          "indexed": true,
          "internalType": "address"
        },
        {
          "name": "symbol",
          "type": "string",
          "indexed": true,
          "internalType": "string"
        },
        {
          "name": "name",
          "type": "string",
          "indexed": false,
          "internalType": "string"
        }
      ],
      "anonymous": false
    },
    {
      "type": "event",
      "name": "Initialized",
      "inputs": [
        {
          "name": "version",
          "type": "uint64",
          "indexed": false,
          "internalType": "uint64"
        }
      ],
      "anonymous": false
    },
    {
      "type": "event",
      "name": "NewTransferRestrictorSet",
      "inputs": [
        {
          "name": "transferRestrictor",
          "type": "address",
          "indexed": true,
          "internalType": "address"
        }
      ],
      "anonymous": false
    },
    {
      "type": "event",
      "name": "OwnershipTransferred",
      "inputs": [
        {
          "name": "previousOwner",
          "type": "address",
          "indexed": true,
          "internalType": "address"
        },
        {
          "name": "newOwner",
          "type": "address",
          "indexed": true,
          "internalType": "address"
        }
      ],
      "anonymous": false
    },
    {
      "type": "event",
      "name": "Upgraded",
      "inputs": [
        {
          "name": "implementation",
          "type": "address",
          "indexed": true,
          "internalType": "address"
        }
      ],
      "anonymous": false
    },
    {
      "type": "error",
      "name": "AddressEmptyCode",
      "inputs": [
        {
          "name": "target",
          "type": "address",
          "internalType": "address"
        }
      ]
    },
    {
      "type": "error",
      "name": "ERC1967InvalidImplementation",
      "inputs": [
        {
          "name": "implementation",
          "type": "address",
          "internalType": "address"
        }
      ]
    },
    {
      "type": "error",
      "name": "ERC1967NonPayable",
      "inputs": []
    },
    {
      "type": "error",
      "name": "FailedInnerCall",
      "inputs": []
    },
    {
      "type": "error",
      "name": "InvalidInitialization",
      "inputs": []
    },
    {
      "type": "error",
      "name": "Mismatch",
      "inputs": []
    },
    {
      "type": "error",
      "name": "NotInitializing",
      "inputs": []
    },
    {
      "type": "error",
      "name": "OwnableInvalidOwner",
      "inputs": [
        {
          "name": "owner",
          "type": "address",
          "internalType": "address"
        }
      ]
    },
    {
      "type": "error",
      "name": "OwnableUnauthorizedAccount",
      "inputs": [
        {
          "name": "account",
          "type": "address",
          "internalType": "address"
        }
      ]
    },
    {
      "type": "error",
      "name": "PreviouslyAnnounced",
      "inputs": []
    },
    {
      "type": "error",
      "name": "UUPSUnauthorizedCallContext",
      "inputs": []
    },
    {
      "type": "error",
      "name": "UUPSUnsupportedProxiableUUID",
      "inputs": [
        {
          "name": "slot",
          "type": "bytes32",
          "internalType": "bytes32"
        }
      ]
    },
    {
      "type": "error",
      "name": "ZeroAddress",
      "inputs": []
    }
  ]
}
