{
  "name": "TokenLockCheck",
  "version": "0.1.0",
  "deployments": {
    "production": {
      "1": "0xc63ac73EcD95a2D6Cb313757378D6c16c760e712",
      "11155111": "0xDE9925851f41B4A405f7C8A44DdaB399D861dC5b",
      "42161": "0x57591E07eAB6c2B3BeE529586253217584316B2B",
      "81457": "0x7e599C828C42758be0A6336DC32334b8AFB6A8FC"
    },
    "staging": {
      "11155111": "0xB12CC65B851F892934285E6f603ac8eeb48793AA",
      "421614": "0x0835bA5A91bbF9c146d18208B8E8Cc4E70198f5e",
      "161221135": "0x50d0A27B24423D27c8dba04213cd22f2Aa067683"
    }
  },
  "abi": [
    {
      "inputs": [
        {
          "internalType": "address",
          "name": "usdc",
          "type": "address"
        },
        {
          "internalType": "address",
          "name": "usdt",
          "type": "address"
        }
      ],
      "stateMutability": "nonpayable",
      "type": "constructor"
    },
    {
      "inputs": [],
      "name": "NotContract",
      "type": "error"
    },
    {
      "anonymous": false,
      "inputs": [
        {
          "indexed": true,
          "internalType": "address",
          "name": "previousOwner",
          "type": "address"
        },
        {
          "indexed": true,
          "internalType": "address",
          "name": "newOwner",
          "type": "address"
        }
      ],
      "name": "OwnershipTransferred",
      "type": "event"
    },
    {
      "inputs": [
        {
          "internalType": "address",
          "name": "",
          "type": "address"
        }
      ],
      "name": "callSelector",
      "outputs": [
        {
          "internalType": "bytes4",
          "name": "",
          "type": "bytes4"
        }
      ],
      "stateMutability": "view",
      "type": "function"
    },
    {
      "inputs": [
        {
          "internalType": "address",
          "name": "token",
          "type": "address"
        },
        {
          "internalType": "address",
          "name": "account",
          "type": "address"
        }
      ],
      "name": "isTransferLocked",
      "outputs": [
        {
          "internalType": "bool",
          "name": "",
          "type": "bool"
        }
      ],
      "stateMutability": "view",
      "type": "function"
    },
    {
      "inputs": [],
      "name": "owner",
      "outputs": [
        {
          "internalType": "address",
          "name": "",
          "type": "address"
        }
      ],
      "stateMutability": "view",
      "type": "function"
    },
    {
      "inputs": [],
      "name": "renounceOwnership",
      "outputs": [],
      "stateMutability": "nonpayable",
      "type": "function"
    },
    {
      "inputs": [
        {
          "internalType": "address",
          "name": "token",
          "type": "address"
        }
      ],
      "name": "setAsDShare",
      "outputs": [],
      "stateMutability": "nonpayable",
      "type": "function"
    },
    {
      "inputs": [
        {
          "internalType": "address",
          "name": "token",
          "type": "address"
        },
        {
          "internalType": "bytes4",
          "name": "selector",
          "type": "bytes4"
        }
      ],
      "name": "setCallSelector",
      "outputs": [],
      "stateMutability": "nonpayable",
      "type": "function"
    },
    {
      "inputs": [
        {
          "internalType": "address",
          "name": "newOwner",
          "type": "address"
        }
      ],
      "name": "transferOwnership",
      "outputs": [],
      "stateMutability": "nonpayable",
      "type": "function"
    }
  ]
}
