{
  "name": "UnityOracle",
  "version": "0.3.3",
  "deployments": {
    "production": {
      "1": "0x942AB403B2e20a5a9940eE9Cb073e5850B04330F",
      "42161": "0x6a05Db7bdab407Bc80D4A09bA8A22de303bAe81A"
    },
    "staging": {
      "11155111": "0x1E6F58EEE791a41D79855840B8d382Fb564Ff377",
      "421614": "0xc92aA0cB8910b9B4673D75E5C27C14eEeFBee5b6",
      "161221135": "0x100b5E7983730b8bF07361210d7a7e125CaC8ac5"
    }
  },
  "abi": [
    {
      "type": "function",
      "name": "decimals",
      "inputs": [],
      "outputs": [
        {
          "name": "",
          "type": "uint8",
          "internalType": "uint8"
        }
      ],
      "stateMutability": "pure"
    },
    {
      "type": "function",
      "name": "description",
      "inputs": [],
      "outputs": [
        {
          "name": "",
          "type": "string",
          "internalType": "string"
        }
      ],
      "stateMutability": "pure"
    },
    {
      "type": "function",
      "name": "getRoundData",
      "inputs": [
        {
          "name": "",
          "type": "uint80",
          "internalType": "uint80"
        }
      ],
      "outputs": [
        {
          "name": "roundId",
          "type": "uint80",
          "internalType": "uint80"
        },
        {
          "name": "answer",
          "type": "int256",
          "internalType": "int256"
        },
        {
          "name": "startedAt",
          "type": "uint256",
          "internalType": "uint256"
        },
        {
          "name": "updatedAt",
          "type": "uint256",
          "internalType": "uint256"
        },
        {
          "name": "answeredInRound",
          "type": "uint80",
          "internalType": "uint80"
        }
      ],
      "stateMutability": "pure"
    },
    {
      "type": "function",
      "name": "latestRoundData",
      "inputs": [],
      "outputs": [
        {
          "name": "roundId",
          "type": "uint80",
          "internalType": "uint80"
        },
        {
          "name": "answer",
          "type": "int256",
          "internalType": "int256"
        },
        {
          "name": "startedAt",
          "type": "uint256",
          "internalType": "uint256"
        },
        {
          "name": "updatedAt",
          "type": "uint256",
          "internalType": "uint256"
        },
        {
          "name": "answeredInRound",
          "type": "uint80",
          "internalType": "uint80"
        }
      ],
      "stateMutability": "pure"
    },
    {
      "type": "function",
      "name": "version",
      "inputs": [],
      "outputs": [
        {
          "name": "",
          "type": "uint256",
          "internalType": "uint256"
        }
      ],
      "stateMutability": "pure"
    }
  ]
}
