{
  "name": "UpgradeableBeacon",
  "version": "1.0.0",
  "deployments": {
    "production": {
      "98866": "0xF4950A31566cDBA1140058178e1AA3eC8afF3228",
      "98867": "0xF4950A31566cDBA1140058178e1AA3eC8afF3228"
    },
    "staging": {
      "1": "0x4F597f4457B24695BC72c42302d4493050ADeE46",
      "7887": "0x4F597f4457B24695BC72c42302d4493050ADeE46",
      "8453": "0x4F597f4457B24695BC72c42302d4493050ADeE46",
      "42161": "0x4F597f4457B24695BC72c42302d4493050ADeE46",
      "81457": "0x9381c0e2EF8F6e8B216819b3eF04E73cdD783D4c",
      "84532": "0x4F597f4457B24695BC72c42302d4493050ADeE46",
      "98866": "0xAaB94e1390519bFF1b41E4CdFBF8A4843e636Ec5",
      "98867": "0x5405C077b4f15132039891545B224cEF90483809",
      "421614": "0x4F597f4457B24695BC72c42302d4493050ADeE46",
      "11155111": "0xf141B07Fb838c4a59334715B4464878EB25E9E60",
      "168587773": "0x68D8d02D15fCB6289D67208a63157B7d1908d169"
    }
  },
  "abi": [
    {
      "type": "constructor",
      "inputs": [
        {
          "name": "implementation_",
          "type": "address",
          "internalType": "address"
        },
        {
          "name": "initialOwner",
          "type": "address",
          "internalType": "address"
        }
      ],
      "stateMutability": "nonpayable"
    },
    {
      "type": "function",
      "name": "implementation",
      "inputs": [],
      "outputs": [
        {
          "name": "",
          "type": "address",
          "internalType": "address"
        }
      ],
      "stateMutability": "view"
    },
    {
      "type": "function",
      "name": "owner",
      "inputs": [],
      "outputs": [
        {
          "name": "",
          "type": "address",
          "internalType": "address"
        }
      ],
      "stateMutability": "view"
    },
    {
      "type": "function",
      "name": "renounceOwnership",
      "inputs": [],
      "outputs": [],
      "stateMutability": "nonpayable"
    },
    {
      "type": "function",
      "name": "transferOwnership",
      "inputs": [
        {
          "name": "newOwner",
          "type": "address",
          "internalType": "address"
        }
      ],
      "outputs": [],
      "stateMutability": "nonpayable"
    },
    {
      "type": "function",
      "name": "upgradeTo",
      "inputs": [
        {
          "name": "newImplementation",
          "type": "address",
          "internalType": "address"
        }
      ],
      "outputs": [],
      "stateMutability": "nonpayable"
    },
    {
      "type": "event",
      "name": "OwnershipTransferred",
      "inputs": [
        {
          "name": "previousOwner",
          "type": "address",
          "indexed": true,
          "internalType": "address"
        },
        {
          "name": "newOwner",
          "type": "address",
          "indexed": true,
          "internalType": "address"
        }
      ],
      "anonymous": false
    },
    {
      "type": "event",
      "name": "Upgraded",
      "inputs": [
        {
          "name": "implementation",
          "type": "address",
          "indexed": true,
          "internalType": "address"
        }
      ],
      "anonymous": false
    },
    {
      "type": "error",
      "name": "BeaconInvalidImplementation",
      "inputs": [
        {
          "name": "implementation",
          "type": "address",
          "internalType": "address"
        }
      ]
    },
    {
      "type": "error",
      "name": "OwnableInvalidOwner",
      "inputs": [
        {
          "name": "owner",
          "type": "address",
          "internalType": "address"
        }
      ]
    },
    {
      "type": "error",
      "name": "OwnableUnauthorizedAccount",
      "inputs": [
        {
          "name": "account",
          "type": "address",
          "internalType": "address"
        }
      ]
    }
  ]
}
