{
  "name": "UpgradeableBeacon",
  "version": "1.0.0",
  "deployments": {
    "production": {
      "98866": "0x37d081bF0fCaf8aaf1Df808131187F29bC8Cb29b",
      "98867": "0x37d081bF0fCaf8aaf1Df808131187F29bC8Cb29b"
    },
    "staging": {
      "1": "0xAaB94e1390519bFF1b41E4CdFBF8A4843e636Ec5",
      "7887": "0xAaB94e1390519bFF1b41E4CdFBF8A4843e636Ec5",
      "8453": "0xAaB94e1390519bFF1b41E4CdFBF8A4843e636Ec5",
      "42161": "0xAaB94e1390519bFF1b41E4CdFBF8A4843e636Ec5",
      "81457": "0x68D8d02D15fCB6289D67208a63157B7d1908d169",
      "84532": "0xAaB94e1390519bFF1b41E4CdFBF8A4843e636Ec5",
      "98866": "0x4cdBd5A0938BE8c57DED76880f774db67dc915A9",
      "98867": "0x4fD0e4797b14a212FF10f6e8c6E769B116A4EF4f",
      "421614": "0xAaB94e1390519bFF1b41E4CdFBF8A4843e636Ec5",
      "11155111": "0x68Dd74e23461d99b7312Bfb5baddfd3Fa28404c7",
      "168587773": "0x661CAe699fa0C3D51E2bfd71F37f97fD2eFC3e89"
    }
  },
  "abi": [
    {
      "type": "constructor",
      "inputs": [
        {
          "name": "implementation_",
          "type": "address",
          "internalType": "address"
        },
        {
          "name": "initialOwner",
          "type": "address",
          "internalType": "address"
        }
      ],
      "stateMutability": "nonpayable"
    },
    {
      "type": "function",
      "name": "implementation",
      "inputs": [],
      "outputs": [
        {
          "name": "",
          "type": "address",
          "internalType": "address"
        }
      ],
      "stateMutability": "view"
    },
    {
      "type": "function",
      "name": "owner",
      "inputs": [],
      "outputs": [
        {
          "name": "",
          "type": "address",
          "internalType": "address"
        }
      ],
      "stateMutability": "view"
    },
    {
      "type": "function",
      "name": "renounceOwnership",
      "inputs": [],
      "outputs": [],
      "stateMutability": "nonpayable"
    },
    {
      "type": "function",
      "name": "transferOwnership",
      "inputs": [
        {
          "name": "newOwner",
          "type": "address",
          "internalType": "address"
        }
      ],
      "outputs": [],
      "stateMutability": "nonpayable"
    },
    {
      "type": "function",
      "name": "upgradeTo",
      "inputs": [
        {
          "name": "newImplementation",
          "type": "address",
          "internalType": "address"
        }
      ],
      "outputs": [],
      "stateMutability": "nonpayable"
    },
    {
      "type": "event",
      "name": "OwnershipTransferred",
      "inputs": [
        {
          "name": "previousOwner",
          "type": "address",
          "indexed": true,
          "internalType": "address"
        },
        {
          "name": "newOwner",
          "type": "address",
          "indexed": true,
          "internalType": "address"
        }
      ],
      "anonymous": false
    },
    {
      "type": "event",
      "name": "Upgraded",
      "inputs": [
        {
          "name": "implementation",
          "type": "address",
          "indexed": true,
          "internalType": "address"
        }
      ],
      "anonymous": false
    },
    {
      "type": "error",
      "name": "BeaconInvalidImplementation",
      "inputs": [
        {
          "name": "implementation",
          "type": "address",
          "internalType": "address"
        }
      ]
    },
    {
      "type": "error",
      "name": "OwnableInvalidOwner",
      "inputs": [
        {
          "name": "owner",
          "type": "address",
          "internalType": "address"
        }
      ]
    },
    {
      "type": "error",
      "name": "OwnableUnauthorizedAccount",
      "inputs": [
        {
          "name": "account",
          "type": "address",
          "internalType": "address"
        }
      ]
    }
  ]
}
